{
    "schema_version": "1.0",
    "campaign_id": "phase6-pilot-014",
    "fixture_fingerprints": {
        "click-public": "613959629731c743e252d302f59bd04de848be55e85a30be65ab0d2f3876bd61",
        "codira-public": "740aa0ecbe9dce2169e76bc560b987ef8e2f82b0910e6868290775a67a4638ab",
        "picomatch-public": "65fa2905263005e5fc3ca4d0d9777548b339d88913a24b0a09db52d3b49325ed"
    },
    "task_fingerprints": {
        "documentation-001": "129e4712272c5a336125d9fa22b1a8cbddec5406fc7fd2ceaee1b4046c59d94d",
        "patch-001": "351cb0a2c91618b2051f1c12d1a52698dbc3d678fc011b005bc5b068d248cd77",
        "symbols-001": "50dc33bea035b4edcc36f7f98de5835817d80e6eefbab8e630df20bb98149e4e"
    },
    "task_fixture_ids": {
        "documentation-001": "picomatch-public",
        "patch-001": "click-public",
        "symbols-001": "codira-public"
    },
    "budgets": {
        "max_total_tokens": 80000,
        "max_output_tokens": 1000,
        "timeout_seconds": 600
    },
    "provider": {
        "name": "openrouter",
        "model": "openai/gpt-5.6-terra",
        "reasoning_effort": "medium",
        "wire_api": "responses",
        "max_prompt_usd_per_million": 2,
        "max_completion_usd_per_million": 12
    },
    "accounting": {
        "max_daily_spend_usd": 6,
        "max_estimated_attempt_spend_usd": 0.5,
        "max_estimated_pilot_spend_usd": 3,
        "max_response_requests_per_attempt": 12
    },
    "resource_controls": {
        "network": "none",
        "read_only_rootfs": true,
        "pids_limit": 512,
        "tmpfs_size_mib": 128
    },
    "runtime_image": "localhost/codira-phase6-pilot@sha256:e7ded5da0e93f4d5372963165d545b779afe717879cca938125067d82099194e",
    "visibility": "public"
}
