{
  "schema_version": "1.0",
  "campaign_id": "codira-efficacy-calibration-001",
  "fixture_fingerprints": {
    "codira-public": "740aa0ecbe9dce2169e76bc560b987ef8e2f82b0910e6868290775a67a4638ab"
  },
  "task_fingerprints": {
    "symbols-001": "b42a9db6ad50a1bc8239ec6ca663281e8bfb74697068796f2e0f9fbfd99003cd"
  },
  "task_fixture_ids": {
    "symbols-001": "codira-public"
  },
  "budgets": {
    "max_total_tokens": 200000,
    "max_output_tokens": 32000,
    "timeout_seconds": 900
  },
  "provider": {
    "name": "openrouter",
    "model": "deepseek/deepseek-v4.1-flash",
    "reasoning_effort": "none",
    "wire_api": "responses",
    "max_prompt_usd_per_million": 0.15,
    "max_completion_usd_per_million": 0.6
  },
  "accounting": {
    "max_daily_spend_usd": 6,
    "max_estimated_attempt_spend_usd": 0.15,
    "max_estimated_pilot_spend_usd": 0.15,
    "max_response_requests_per_attempt": 1
  },
  "resource_controls": {
    "network": "none",
    "read_only_rootfs": true,
    "pids_limit": 512,
    "tmpfs_size_mib": 128
  },
  "runtime_image": "localhost/codira-phase6-onnx@sha256:57e461389adc7d14a22684c4fc92558300900d3165517e64c33594c80d336c89",
  "runtime_profile_fingerprint": "505d9aa2d761657199fa63de526dea33c1e4aacef030c2f45e3216526643f680",
  "treatment_protocol": {
    "version": "mcp-required-v1",
    "codira_mcp_instruction": "Before completing this task, call the configured Codira MCP server at least once."
  },
  "visibility": "public"
}
